{
  "version": 21,
  "variables": [
    {
      "version": 2,
      "key": "Rail",
      "type": "csv",
      "visible": true,
      "editable": true,
      "input": "ALL,NPP,BPAY,INTERNAL,SWIFT",
      "multiple": false
    },
    {
      "version": 2,
      "key": "PaymentType",
      "type": "csv",
      "visible": true,
      "editable": true,
      "input": "ALL,PAYID,BPAY,ACCOUNT_TRANSFER,INTERNATIONAL_TRANSFER",
      "multiple": false
    },
    {
      "version": 2,
      "key": "Channel",
      "type": "csv",
      "visible": true,
      "editable": true,
      "input": "ALL,ANZ_PLUS,MOBILE_BANKING,INTERNET_BANKING,CORPORATE_API",
      "multiple": false
    },
    {
      "version": 2,
      "key": "CustomerSegment",
      "type": "csv",
      "visible": true,
      "editable": true,
      "input": "ALL,RETAIL,SMALL_BUSINESS,CORPORATE",
      "multiple": false
    },
    {
      "version": 2,
      "key": "Scenario",
      "type": "csv",
      "visible": true,
      "editable": true,
      "input": "ALL,NORMAL,SLOW_SETTLEMENT,FAILED_PAYMENT",
      "multiple": false
    },
    {
      "version": 2,
      "key": "TransactionId",
      "type": "text",
      "visible": true,
      "editable": true,
      "defaultValue": ""
    },
    {
      "version": 2,
      "key": "SlowSeconds",
      "type": "csv",
      "visible": true,
      "editable": true,
      "input": "3,1,2,5,8",
      "multiple": false
    }
  ],
  "tiles": {
    "1": {
      "type": "markdown",
      "content": "# Payments — Activity, Outcomes & Journey\nSynthetic outbound AUD payments. Business KPIs read extracted completion events; operational detail reads logs.\nUse the timeframe and filters above. Completed = confirmed SUCCESS + FAILED. Failure rate uses that same denominator. Scripted coverage is deliberately failure-heavy; these are observed demo results, not production failure rates. SlowSeconds is a demo threshold, not a banking SLA."
    },
    "2": {
      "type": "data",
      "title": "Completed payments",
      "query": "fetch bizevents\n| filter event.type == \"demo.payment.completed\" and event.provider == \"synthetic-payments-demo\"\n| filter demo.name == \"synthetic-payments-demo\" and demo.schema_version == \"1\"\n| filter isNotNull(payment.transaction_id)\n| dedup payment.transaction_id, sort: {payment.source_timestamp desc, payment.status desc, payment.service desc, payment.total_duration_ms desc, payment.error_code desc, payment.trace_id desc, payment.span_id desc, payment.amount desc, payment.type desc, payment.rail desc, payment.channel desc, payment.customer_segment desc, payment.scenario desc, payment.journey_id desc, payment.currency desc, payment.direction desc, payment.step_sequence desc, payment.risk_score desc, payment.fraud_decision desc, payment.error_message desc}\n| filter $Rail == \"ALL\" or payment.rail == $Rail\n| filter $PaymentType == \"ALL\" or payment.type == $PaymentType\n| filter $Channel == \"ALL\" or payment.channel == $Channel\n| filter $CustomerSegment == \"ALL\" or payment.customer_segment == $CustomerSegment\n| filter $Scenario == \"ALL\" or payment.scenario == $Scenario\n| filter $TransactionId == \"\" or payment.transaction_id == $TransactionId\n| filter payment.outcome == \"SUCCESS\" or payment.outcome == \"FAILED\"\n| summarize completed = count()",
      "visualization": "singleValue",
      "visualizationSettings": {},
      "querySettings": {}
    },
    "3": {
      "type": "data",
      "title": "Successful payments",
      "query": "fetch bizevents\n| filter event.type == \"demo.payment.completed\" and event.provider == \"synthetic-payments-demo\"\n| filter demo.name == \"synthetic-payments-demo\" and demo.schema_version == \"1\"\n| filter isNotNull(payment.transaction_id)\n| dedup payment.transaction_id, sort: {payment.source_timestamp desc, payment.status desc, payment.service desc, payment.total_duration_ms desc, payment.error_code desc, payment.trace_id desc, payment.span_id desc, payment.amount desc, payment.type desc, payment.rail desc, payment.channel desc, payment.customer_segment desc, payment.scenario desc, payment.journey_id desc, payment.currency desc, payment.direction desc, payment.step_sequence desc, payment.risk_score desc, payment.fraud_decision desc, payment.error_message desc}\n| filter $Rail == \"ALL\" or payment.rail == $Rail\n| filter $PaymentType == \"ALL\" or payment.type == $PaymentType\n| filter $Channel == \"ALL\" or payment.channel == $Channel\n| filter $CustomerSegment == \"ALL\" or payment.customer_segment == $CustomerSegment\n| filter $Scenario == \"ALL\" or payment.scenario == $Scenario\n| filter $TransactionId == \"\" or payment.transaction_id == $TransactionId\n| summarize successful = countIf(payment.outcome == \"SUCCESS\")",
      "visualization": "singleValue",
      "visualizationSettings": {},
      "querySettings": {}
    },
    "4": {
      "type": "data",
      "title": "Failed payments",
      "query": "fetch bizevents\n| filter event.type == \"demo.payment.completed\" and event.provider == \"synthetic-payments-demo\"\n| filter demo.name == \"synthetic-payments-demo\" and demo.schema_version == \"1\"\n| filter isNotNull(payment.transaction_id)\n| dedup payment.transaction_id, sort: {payment.source_timestamp desc, payment.status desc, payment.service desc, payment.total_duration_ms desc, payment.error_code desc, payment.trace_id desc, payment.span_id desc, payment.amount desc, payment.type desc, payment.rail desc, payment.channel desc, payment.customer_segment desc, payment.scenario desc, payment.journey_id desc, payment.currency desc, payment.direction desc, payment.step_sequence desc, payment.risk_score desc, payment.fraud_decision desc, payment.error_message desc}\n| filter $Rail == \"ALL\" or payment.rail == $Rail\n| filter $PaymentType == \"ALL\" or payment.type == $PaymentType\n| filter $Channel == \"ALL\" or payment.channel == $Channel\n| filter $CustomerSegment == \"ALL\" or payment.customer_segment == $CustomerSegment\n| filter $Scenario == \"ALL\" or payment.scenario == $Scenario\n| filter $TransactionId == \"\" or payment.transaction_id == $TransactionId\n| summarize failed = countIf(payment.outcome == \"FAILED\")",
      "visualization": "singleValue",
      "visualizationSettings": {},
      "querySettings": {}
    },
    "5": {
      "type": "data",
      "title": "Confirmed failure rate (%)",
      "query": "fetch bizevents\n| filter event.type == \"demo.payment.completed\" and event.provider == \"synthetic-payments-demo\"\n| filter demo.name == \"synthetic-payments-demo\" and demo.schema_version == \"1\"\n| filter isNotNull(payment.transaction_id)\n| dedup payment.transaction_id, sort: {payment.source_timestamp desc, payment.status desc, payment.service desc, payment.total_duration_ms desc, payment.error_code desc, payment.trace_id desc, payment.span_id desc, payment.amount desc, payment.type desc, payment.rail desc, payment.channel desc, payment.customer_segment desc, payment.scenario desc, payment.journey_id desc, payment.currency desc, payment.direction desc, payment.step_sequence desc, payment.risk_score desc, payment.fraud_decision desc, payment.error_message desc}\n| filter $Rail == \"ALL\" or payment.rail == $Rail\n| filter $PaymentType == \"ALL\" or payment.type == $PaymentType\n| filter $Channel == \"ALL\" or payment.channel == $Channel\n| filter $CustomerSegment == \"ALL\" or payment.customer_segment == $CustomerSegment\n| filter $Scenario == \"ALL\" or payment.scenario == $Scenario\n| filter $TransactionId == \"\" or payment.transaction_id == $TransactionId\n| filter payment.outcome == \"SUCCESS\" or payment.outcome == \"FAILED\"\n| summarize completed = count(), failed = countIf(payment.outcome == \"FAILED\")\n| fields failure_rate_percent = if(completed > 0, 100.0 * failed / completed, else: null)",
      "visualization": "singleValue",
      "visualizationSettings": {},
      "querySettings": {}
    },
    "6": {
      "type": "data",
      "title": "P95 end-to-end (seconds)",
      "query": "fetch bizevents\n| filter event.type == \"demo.payment.completed\" and event.provider == \"synthetic-payments-demo\"\n| filter demo.name == \"synthetic-payments-demo\" and demo.schema_version == \"1\"\n| filter isNotNull(payment.transaction_id)\n| dedup payment.transaction_id, sort: {payment.source_timestamp desc, payment.status desc, payment.service desc, payment.total_duration_ms desc, payment.error_code desc, payment.trace_id desc, payment.span_id desc, payment.amount desc, payment.type desc, payment.rail desc, payment.channel desc, payment.customer_segment desc, payment.scenario desc, payment.journey_id desc, payment.currency desc, payment.direction desc, payment.step_sequence desc, payment.risk_score desc, payment.fraud_decision desc, payment.error_message desc}\n| filter $Rail == \"ALL\" or payment.rail == $Rail\n| filter $PaymentType == \"ALL\" or payment.type == $PaymentType\n| filter $Channel == \"ALL\" or payment.channel == $Channel\n| filter $CustomerSegment == \"ALL\" or payment.customer_segment == $CustomerSegment\n| filter $Scenario == \"ALL\" or payment.scenario == $Scenario\n| filter $TransactionId == \"\" or payment.transaction_id == $TransactionId\n| filter payment.outcome == \"SUCCESS\" or payment.outcome == \"FAILED\"\n| filter payment.total_duration_ms >= 0\n| summarize p95_seconds = percentile(payment.total_duration_ms / 1000.0, 95)",
      "visualization": "singleValue",
      "visualizationSettings": {},
      "querySettings": {}
    },
    "7": {
      "type": "data",
      "title": "Successful payment value (AUD)",